{
  "_D": "urn:oasis:names:specification:ubl:schema:xsd:GoodsCertificate-2",
  "_A": "urn:oasis:names:specification:ubl:schema:xsd:CommonAggregateComponents-2",
  "_B": "urn:oasis:names:specification:ubl:schema:xsd:CommonBasicComponents-2",
  "GoodsCertificate": [
    {
      "ID": [{ "_": "ExampleID" }],
      "UUID": [{ "_": "ExampleUUID" }],
      "IssueDate": [{ "_": "2020-06-23" }],
      "TypeCode": [{ "_": "ChinaFish" }],
      "ConsignorParty": [
        {
          "PartyIdentification": [
            {
              "ID": [{ "_": "1234" }]
            }
          ],
          "PartyName": [
            {
              "Name": [{ "_": "ConsignorExample" }]
            }
          ],
          "PostalAddress": [
            {
              "StreetName": [{ "_": "ExampleStreet" }],
              "CityName": [{ "_": "Example City" }],
              "PostalZone": [{ "_": "1234" }],
              "Country": [
                {
                  "IdentificationCode": [{ "_": "DK" }],
                  "Name": [{ "_": "Denmark" }]
                }
              ]
            }
          ],
          "PartyLegalEntity": [
            {
              "CompanyID": [{ "_": "DK12345678" }]
            }
          ],
          "Contact": [
            {
              "ID": [{ "_": "8447" }],
              "Name": [{ "_": "Document Robot" }]
            }
          ]
        }
      ],
      "FreightForwarderParty": [
        {
          "PartyIdentification": [
            {
              "ID": [{ "_": "13234212" }]
            }
          ],
          "PartyName": [
            {
              "Name": [{ "_": "Example Shipping" }]
            }
          ],
          "PostalAddress": [
            {
              "StreetName": [{ "_": "Street" }],
              "CityName": [{ "_": "City" }],
              "PostalZone": [{ "_": "Post" }],
              "Country": [
                {
                  "IdentificationCode": [{ "_": "DK" }]
                }
              ]
            }
          ],
          "PartyLegalEntity": [
            {
              "CompanyID": [{ "_": "1323421212" }]
            }
          ],
          "Contact": [
            {
              "ID": [{ "_": "11" }]
            }
          ]
        }
      ],
      "IssuerParty": [
        {
          "PartyName": [
            {
              "Name": [{ "_": "ConsignorExample" }]
            }
          ],
          "PostalAddress": [
            {
              "StreetName": [{ "_": "ExampleStreet" }],
              "CityName": [{ "_": "Example City" }],
              "PostalZone": [{ "_": "1234" }],
              "Country": [
                {
                  "IdentificationCode": [{ "_": "DK" }],
                  "Name": [{ "_": "Denmark" }]
                }
              ]
            }
          ],
          "PartyLegalEntity": [
            {
              "CompanyID": [{ "_": "DK12345678" }]
            }
          ],
          "Contact": [
            {
              "ID": [{ "_": "8447" }],
              "Name": [{ "_": "Document Robot" }]
            }
          ]
        }
      ],
      "Shipment": [
        {
          "ID": [{ "_": "381944545" }],
          "Consignment": [
            {
              "ID": [{ "_": "2076084807" }],
              "GrossWeightMeasure": [{ "_": 774.144, "unitCode": "KG" }],
              "NetWeightMeasure": [{ "_": 604.8, "unitCode": "KG" }],
              "SequenceID": [{ "_": "203" }],
              "DeliveryInstructions": [{ "_": "El Dorado" }],
              "RequestedPickupTransportEvent": [
                {
                  "Contact": [
                    {
                      "Name": [{ "_": "ExampleName" }]
                    }
                  ],
                  "Location": [
                    {
                      "ID": [
                        { "_": "M165", "schemeID": "AuthorisationNumber" }
                      ],
                      "Address": [
                        {
                          "StreetName": [{ "_": "ExampleStreet 1" }],
                          "CityName": [{ "_": "Videbæk" }],
                          "PostalZone": [{ "_": "6920" }],
                          "AddressLine": [
                            {
                              "Line": [
                                { "_": "ExampleStreet 1, DK-6920 Videbæk" }
                              ]
                            }
                          ],
                          "Country": [
                            {
                              "IdentificationCode": [{ "_": "DK" }],
                              "Name": [{ "_": "Denmark" }]
                            }
                          ]
                        }
                      ]
                    }
                  ],
                  "Period": [
                    {
                      "StartDate": [{ "_": "2020-06-02" }],
                      "EndDate": [{ "_": "2020-06-02" }]
                    }
                  ]
                }
              ],
              "RequestedDeliveryTransportEvent": [
                {
                  "Location": [
                    {
                      "Address": [
                        {
                          "StreetName": [{ "_": "StreetName Example" }],
                          "CityName": [{ "_": "El Dorado" }],
                          "Country": [
                            {
                              "IdentificationCode": [{ "_": "PA" }],
                              "Name": [{ "_": "Panama" }]
                            }
                          ]
                        }
                      ]
                    }
                  ],
                  "Period": [
                    {
                      "StartDate": [{ "_": "2020-07-01" }],
                      "EndDate": [{ "_": "2020-07-01" }]
                    }
                  ]
                }
              ],
              "ConsigneeParty": [
                {
                  "PartyIdentification": [
                    {
                      "ID": [{ "_": "0004424005" }]
                    }
                  ],
                  "PartyName": [
                    {
                      "Name": [{ "_": "ConsigneeExample" }]
                    }
                  ],
                  "PostalAddress": [
                    {
                      "StreetName": [{ "_": "StreetName Example" }],
                      "AdditionalStreetName": [
                        { "_": "AdditionalStreet Example" }
                      ],
                      "CityName": [{ "_": "El Dorado" }],
                      "Country": [
                        {
                          "IdentificationCode": [{ "_": "PA" }],
                          "Name": [{ "_": "Panama" }]
                        }
                      ]
                    }
                  ]
                }
              ],
              "ConsignorParty": [
                {
                  "PartyIdentification": [
                    {
                      "ID": [{ "_": "1080" }]
                    }
                  ],
                  "PartyName": [
                    {
                      "Name": [{ "_": "ExampleName" }]
                    }
                  ],
                  "PostalAddress": [
                    {
                      "StreetName": [{ "_": "ExampleStreet" }],
                      "CityName": [{ "_": "Viby J" }],
                      "PostalZone": [{ "_": "8260" }],
                      "Country": [
                        {
                          "IdentificationCode": [{ "_": "DK" }],
                          "Name": [{ "_": "Denmark" }]
                        }
                      ]
                    }
                  ]
                }
              ],
              "OriginalDepartureCountry": [
                {
                  "IdentificationCode": [{ "_": "DK" }],
                  "Name": [{ "_": "Denmark" }]
                }
              ],
              "DeliveryTerms": [
                {
                  "ID": [{ "_": "CIP" }],
                  "DeliveryLocation": [
                    {
                      "Name": [{ "_": "Balboa Port" }]
                    }
                  ]
                }
              ],
              "FreightAllowanceCharge": [
                {
                  "ChargeIndicator": [{ "_": true }],
                  "Amount": [{ "_": 0.0, "currencyID": "DKK" }]
                }
              ],
              "MainCarriageShipmentStage": [
                {
                  "TransportModeCode": [{ "_": "1", "name": "Sea" }],
                  "LoadingPortLocation": [
                    {
                      "ID": [{ "_": "Aarhus" }]
                    }
                  ],
                  "UnloadingPortLocation": [
                    {
                      "ID": [{ "_": "Balboa Port" }]
                    }
                  ]
                }
              ],
              "TransportHandlingUnit": [
                {
                  "ID": [{ "_": "USRM3656679" }],
                  "TotalPackageQuantity": [{ "_": 1, "unitCode": "EA" }],
                  "TransportEquipment": [
                    {
                      "TransportEquipmentSeal": [
                        {
                          "ID": [{ "_": "7654321" }]
                        }
                      ]
                    }
                  ],
                  "MaximumTemperature": [
                    {
                      "AttributeID": [{ "_": "TC" }],
                      "Measure": [{ "_": 3.0, "unitCode": "CEL" }],
                      "Description": [{ "_": "Chilled" }]
                    }
                  ],
                  "Package": [
                    {
                      "ID": [{ "_": "2076084807" }],
                      "Quantity": [{ "_": 1, "unitCode": "EA" }],